{
  "artifactRefPublished": false,
  "branch": "main",
  "endpointActivated": false,
  "endpointStaged": false,
  "environment": "release",
  "environmentSecretUpdated": true,
  "headCommit": "cdaaecfa1f1a4bcc5731ca33b11669c5addf3939",
  "releaseRefsUnchanged": true,
  "repository": "N0RMANCHEN/cloudx",
  "runId": 42,
  "schema": "cloudx.release-workflow-key.v1",
  "secret": "CLOUDX_RELEASE_SIGNING_KEY",
  "secretExistedBefore": true,
  "serviceRestarted": false,
  "signedReleaseVerified": true,
  "signerFingerprint": "SHA256:oEhvhqj9U4wM8zLz8w43A/fvMN+BRNXO1k5/3eVPh9o",
  "stableMoved": false,
  "status": "canary-accepted",
  "tagCreated": false,
  "version": "0.1.15",
  "workflow": "release.yml",
  "workflowDispatched": true
}
